No.;Time;Source;Destination;Protocol;Length;Info;;;Time 1;Time 2;Delay;Delay 1;Delay 2;Jitter
1;0;192.168.1.9;131.253.33.203;TCP;54;49828  >  443 [RST, ACK] Seq=1 Ack=1 Win=0 Len=0;;;0;2,327012;2,327012;2,301428;0,025584;-2,275844
30;2,327012;192.168.1.9;20.212.96.199;TCP;66;49835  >  443 [SYN] Seq=0 Win=64240 Len=0 MSS=1460 WS=256 SACK_PERM=1;;;2,327012;2,352596;0,025584;0,025378;0,000206;-0,025172
43;2,352596;20.212.96.199;192.168.1.9;TCP;66;443  >  49835 [SYN, ACK] Seq=0 Ack=1 Win=65535 Len=0 MSS=1440 WS=256 SACK_PERM=1;;;2,352596;2,352802;0,000206;-0,000537;0,000743;0,00128
44;2,352802;192.168.1.9;20.212.96.199;TCP;54;49835  >  443 [ACK] Seq=1 Ack=1 Win=132352 Len=0;;;2,352802;2,353545;0,000743;-0,024799;0,025542;0,050341
45;2,353545;192.168.1.9;20.212.96.199;TLSv1.2;571;Client Hello;;;2,353545;2,379087;0,025542;0,025542;0;-0,025542
50;2,379087;20.212.96.199;192.168.1.9;TCP;1506;443  >  49835 [ACK] Seq=1 Ack=518 Win=525056 Len=1452 [TCP segment of a reassembled PDU];;;2,379087;2,379087;0;0;0;0
51;2,379087;20.212.96.199;192.168.1.9;TCP;1506;443  >  49835 [ACK] Seq=1453 Ack=518 Win=525056 Len=1452 [TCP segment of a reassembled PDU];;;2,379087;2,379087;0;0;0;0
52;2,379087;20.212.96.199;192.168.1.9;TCP;1506;443  >  49835 [ACK] Seq=2905 Ack=518 Win=525056 Len=1452 [TCP segment of a reassembled PDU];;;2,379087;2,379087;0;-0,000134;0,000134;0,000268
53;2,379087;20.212.96.199;192.168.1.9;TLSv1.2;1033;Server Hello, Certificate, Server Key Exchange, Server Hello Done;;;2,379087;2,379221;0,000134;-0,003053;0,003187;0,00624
54;2,379221;192.168.1.9;20.212.96.199;TCP;54;49835  >  443 [ACK] Seq=518 Ack=5336 Win=132352 Len=0;;;2,379221;2,382408;0,003187;-0,02208;0,025267;0,047347
55;2,382408;192.168.1.9;20.212.96.199;TLSv1.2;212;Client Key Exchange, Change Cipher Spec, Encrypted Handshake Message;;;2,382408;2,407675;0,025267;0,02475;0,000517;-0,024233
56;2,407675;20.212.96.199;192.168.1.9;TLSv1.2;105;Change Cipher Spec, Encrypted Handshake Message;;;2,407675;2,408192;0,000517;0,000517;0;-0,000517
57;2,408192;192.168.1.9;20.212.96.199;TCP;1494;49835  >  443 [ACK] Seq=676 Ack=5387 Win=132352 Len=1440 [TCP segment of a reassembled PDU];;;2,408192;2,408192;0;-0,025586;0,025586;0,051172
58;2,408192;192.168.1.9;20.212.96.199;TLSv1.2;130;Application Data;;;2,408192;2,433778;0,025586;0,023579;0,002007;-0,021572
59;2,433778;20.212.96.199;192.168.1.9;TCP;54;443  >  49835 [ACK] Seq=5387 Ack=2192 Win=525568 Len=0;;;2,433778;2,435785;0,002007;0,001886;0,000121;-0,001765
60;2,435785;20.212.96.199;192.168.1.9;TLSv1.2;762;Application Data;;;2,435785;2,435906;0,000121;-0,000125;0,000246;0,000371
61;2,435906;192.168.1.9;20.212.96.199;TCP;54;49835  >  443 [ACK] Seq=2192 Ack=6096 Win=131584 Len=0;;;2,435906;2,436152;0,000246;0,00012;0,000126;0,000006
62;2,436152;192.168.1.9;20.212.96.199;TLSv1.2;85;Encrypted Alert;;;2,436152;2,436278;0,000126;-0,024618;0,024744;0,049362
63;2,436278;192.168.1.9;20.212.96.199;TCP;54;49835  >  443 [FIN, ACK] Seq=2223 Ack=6096 Win=131584 Len=0;;;2,436278;2,461022;0,024744;0,024744;0;-0,024744
64;2,461022;20.212.96.199;192.168.1.9;TCP;54;[TCP Dup ACK 59#1] 443  >  49835 [ACK] Seq=6096 Ack=2192 Win=525568 Len=0;;;2,461022;2,461022;0;-5,689418;5,689418;11,378836
65;2,461022;20.212.96.199;192.168.1.9;TCP;54;443  >  49835 [ACK] Seq=6096 Ack=2224 Win=525568 Len=0;;;2,461022;8,15044;5,689418;5,689006;0,000412;-5,688594
1188;8,15044;192.168.1.9;31.13.68.60;TLSv1.2;93;Application Data;;;8,15044;8,150852;0,000412;-0,017701;0,018113;0,035814
1189;8,150852;192.168.1.9;31.13.68.60;TLSv1.2;189;Application Data;;;8,150852;8,168965;0,018113;0,018113;0;-0,018113
1190;8,168965;31.13.68.60;192.168.1.9;TCP;56;443  >  49703 [ACK] Seq=1 Ack=40 Win=535 Len=0;;;8,168965;8,168965;0;0;0;0
1191;8,168965;31.13.68.60;192.168.1.9;TCP;56;443  >  49703 [ACK] Seq=1 Ack=175 Win=546 Len=0;;;8,168965;8,168965;0;-0,055623;0,055623;0,111246
1192;8,168965;31.13.68.60;192.168.1.9;TLSv1.2;93;Application Data;;;8,168965;8,224588;0,055623;-7,34841;7,404033;14,752443
1193;8,224588;192.168.1.9;31.13.68.60;TCP;54;49703  >  443 [ACK] Seq=175 Ack=40 Win=2480 Len=0;;;8,224588;15,628621;7,404033;7,402811;0,001222;-7,401589
1217;15,628621;31.13.68.60;192.168.1.9;TCP;1446;443  >  49703 [ACK] Seq=40 Ack=175 Win=546 Len=1392 [TCP segment of a reassembled PDU];;;15,628621;15,629843;0,001222;0,001172;0,00005;-0,001122
1218;15,629843;31.13.68.60;192.168.1.9;TLSv1.2;564;Application Data, Application Data;;;15,629843;15,629893;0,00005;-0,000168;0,000218;0,000386
1219;15,629893;192.168.1.9;31.13.68.60;TCP;54;49703  >  443 [ACK] Seq=175 Ack=1942 Win=2484 Len=0;;;15,629893;15,630111;0,000218;0,000122;0,000096;-0,000026
1220;15,630111;192.168.1.9;31.13.68.60;TLSv1.2;89;Application Data;;;15,630111;15,630207;0,000096;-0,022782;0,022878;0,04566
1221;15,630207;192.168.1.9;31.13.68.60;TLSv1.2;89;Application Data;;;15,630207;15,653085;0,022878;0,022878;0;-0,022878
1223;15,653085;31.13.68.60;192.168.1.9;TCP;56;443  >  49703 [ACK] Seq=1942 Ack=210 Win=546 Len=0;;;15,653085;15,653085;0;-1,511604;1,511604;3,023208
1224;15,653085;31.13.68.60;192.168.1.9;TCP;56;443  >  49703 [ACK] Seq=1942 Ack=245 Win=546 Len=0;;;15,653085;17,164689;1,511604;1,458011;0,053593;-1,404418
1231;17,164689;31.13.68.60;192.168.1.9;TLSv1.2;286;Application Data;;;17,164689;17,218282;0,053593;0,04708;0,006513;-0,040567
1232;17,218282;192.168.1.9;31.13.68.60;TCP;54;49703  >  443 [ACK] Seq=245 Ack=2174 Win=2484 Len=0;;;17,218282;17,224795;0,006513;-0,048693;0,055206;0,103899
1233;17,224795;31.13.68.60;192.168.1.9;TLSv1.2;232;Application Data;;;17,224795;17,280001;0,055206;-0,74955;0,804756;1,554306
1234;17,280001;192.168.1.9;31.13.68.60;TCP;54;49703  >  443 [ACK] Seq=245 Ack=2352 Win=2483 Len=0;;;17,280001;18,084757;0,804756;0,756228;0,048528;-0,7077
1242;18,084757;31.13.68.60;192.168.1.9;TLSv1.2;232;Application Data;;;18,084757;18,133285;0,048528;-4,491609;4,540137;9,031746
1243;18,133285;192.168.1.9;31.13.68.60;TCP;54;49703  >  443 [ACK] Seq=245 Ack=2530 Win=2482 Len=0;;;18,133285;22,673422;4,540137;4,539717;0,00042;-4,539297
1716;22,673422;31.13.68.60;192.168.1.9;TLSv1.2;151;Application Data;;;22,673422;22,673842;0,00042;0,000312;0,000108;-0,000204
1717;22,673842;192.168.1.9;31.13.68.60;TLSv1.2;89;Application Data;;;22,673842;22,67395;0,000108;-0,01853;0,018638;0,037168
1718;22,67395;192.168.1.9;31.13.68.60;TLSv1.2;89;Application Data;;;22,67395;22,692588;0,018638;0,018638;0;-0,018638
1723;22,692588;31.13.68.60;192.168.1.9;TCP;56;443  >  49703 [ACK] Seq=2627 Ack=280 Win=546 Len=0;;;22,692588;22,692588;0;-2,559575;2,559575;5,11915
1724;22,692588;31.13.68.60;192.168.1.9;TCP;56;443  >  49703 [ACK] Seq=2627 Ack=315 Win=546 Len=0;;;22,692588;25,252163;2,559575;2,508647;0,050928;-2,457719
1726;25,252163;31.13.68.60;192.168.1.9;TLSv1.2;270;Application Data;;;25,252163;25,303091;0,050928;-3,984426;4,035354;8,01978
1727;25,303091;192.168.1.9;31.13.68.60;TCP;54;49703  >  443 [ACK] Seq=315 Ack=2843 Win=2481 Len=0;;;25,303091;29,338445;4,035354;4,01079;0,024564;-3,986226
1978;29,338445;192.168.1.9;172.217.194.188;TCP;55;49717  >  5228 [ACK] Seq=1 Ack=1 Win=511 Len=1;;;29,338445;29,363009;0,024564;-10,314591;10,339155;20,653746
1979;29,363009;172.217.194.188;192.168.1.9;TCP;66;5228  >  49717 [ACK] Seq=1 Ack=2 Win=265 Len=0 SLE=1 SRE=2;;;29,363009;39,702164;10,339155;10,338715;0,00044;-10,338275
2473;39,702164;31.13.68.60;192.168.1.9;TLSv1.2;286;Application Data;;;39,702164;39,702604;0,00044;0,000326;0,000114;-0,000212
2474;39,702604;192.168.1.9;31.13.68.60;TLSv1.2;89;Application Data;;;39,702604;39,702718;0,000114;-0,000611;0,000725;0,001336
2475;39,702718;192.168.1.9;31.13.68.60;TLSv1.2;89;Application Data;;;39,702718;39,703443;0,000725;-0,016683;0,017408;0,034091
2476;39,703443;31.13.68.60;192.168.1.9;TLSv1.2;232;Application Data;;;39,703443;39,720851;0,017408;0,017408;0;-0,017408
2477;39,720851;31.13.68.60;192.168.1.9;TCP;56;443  >  49703 [ACK] Seq=3253 Ack=350 Win=546 Len=0;;;39,720851;39,720851;0;-0,033734;0,033734;0,067468
2478;39,720851;31.13.68.60;192.168.1.9;TCP;56;443  >  49703 [ACK] Seq=3253 Ack=385 Win=546 Len=0;;;39,720851;39,754585;0,033734;-1,335739;1,369473;2,705212
2479;39,754585;192.168.1.9;31.13.68.60;TCP;54;49703  >  443 [ACK] Seq=385 Ack=3253 Win=2479 Len=0;;;39,754585;41,124058;1,369473;1,314828;0,054645;-1,260183
2480;41,124058;31.13.68.60;192.168.1.9;TLSv1.2;232;Application Data;;;41,124058;41,178703;0,054645;-3,28562;3,340265;6,625885
2481;41,178703;192.168.1.9;31.13.68.60;TCP;54;49703  >  443 [ACK] Seq=385 Ack=3431 Win=2484 Len=0;;;41,178703;44,518968;3,340265;3,308469;0,031796;-3,276673
2729;44,518968;192.168.1.9;20.197.71.89;TLSv1.2;153;Application Data;;;44,518968;44,550764;0,031796;-0,023425;0,055221;0,078646
2730;44,550764;20.197.71.89;192.168.1.9;TLSv1.2;174;Application Data;;;44,550764;44,605985;0,055221;-24,486314;24,541535;49,027849
2731;44,605985;192.168.1.9;20.197.71.89;TCP;54;49708  >  443 [ACK] Seq=100 Ack=121 Win=515 Len=0;;;44,605985;69,14752;24,541535;24,53903;0,002505;-24,536525
3963;69,14752;192.168.1.9;31.13.68.60;TLSv1.2;93;Application Data;;;69,14752;69,150025;0,002505;-0,016552;0,019057;0,035609
3964;69,150025;192.168.1.9;31.13.68.60;TLSv1.2;94;Application Data;;;69,150025;69,169082;0,019057;0,019057;0;-0,019057
3965;69,169082;31.13.68.60;192.168.1.9;TCP;56;443  >  49703 [ACK] Seq=3431 Ack=424 Win=546 Len=0;;;69,169082;69,169082;0;0;0;0
3966;69,169082;31.13.68.60;192.168.1.9;TCP;56;443  >  49703 [ACK] Seq=3431 Ack=464 Win=546 Len=0;;;69,169082;69,169082;0;-0,052115;0,052115;0,10423
3967;69,169082;31.13.68.60;192.168.1.9;TLSv1.2;93;Application Data;;;69,169082;69,221197;0,052115;-0,075582;0,127697;0,203279
3968;69,221197;192.168.1.9;31.13.68.60;TCP;54;49703  >  443 [ACK] Seq=464 Ack=3470 Win=2484 Len=0;;;69,221197;69,348894;0,127697;0,127262;0,000435;-0,126827
3969;69,348894;31.13.68.60;192.168.1.9;TLSv1.2;101;Application Data;;;69,348894;69,349329;0,000435;0,0003;0,000135;-0,000165
3970;69,349329;192.168.1.9;31.13.68.60;TLSv1.2;89;Application Data;;;69,349329;69,349464;0,000135;-0,018353;0,018488;0,036841
3971;69,349464;192.168.1.9;31.13.68.60;TLSv1.2;89;Application Data;;;69,349464;69,367952;0,018488;-4,986575;5,005063;9,991638
3972;69,367952;31.13.68.60;192.168.1.9;TCP;56;443  >  49703 [ACK] Seq=3517 Ack=534 Win=546 Len=0;;;69,367952;74,373015;5,005063;4,980728;0,024335;-4,956393
3973;74,373015;192.168.1.9;172.217.194.188;TCP;55;[TCP Keep-Alive] 49717  >  5228 [ACK] Seq=1 Ack=1 Win=511 Len=1;;;74,373015;74,39735;0,024335;-1,690787;1,715122;3,405909
3974;74,39735;172.217.194.188;192.168.1.9;TCP;66;[TCP Keep-Alive ACK] 5228  >  49717 [ACK] Seq=1 Ack=2 Win=265 Len=0 SLE=1 SRE=2;;;74,39735;76,112472;1,715122;1,609667;0,105455;-1,504212
4439;76,112472;192.168.1.9;40.79.189.59;TCP;54;49832  >  443 [FIN, ACK] Seq=1 Ack=1 Win=1021 Len=0;;;76,112472;76,217927;0,105455;0,105344;0,000111;-0,105233
4440;76,217927;40.79.189.59;192.168.1.9;TCP;54;443  >  49832 [FIN, ACK] Seq=1 Ack=2 Win=2047 Len=0;;;76,217927;76,218038;0,000111;-6,89207;6,892181;13,784251
4441;76,218038;192.168.1.9;40.79.189.59;TCP;54;49832  >  443 [ACK] Seq=2 Ack=2 Win=1021 Len=0;;;76,218038;83,110219;6,892181;6,891753;0,000428;-6,891325
4442;83,110219;31.13.68.60;192.168.1.9;TLSv1.2;151;Application Data;;;83,110219;83,110647;0,000428;0,00032;0,000108;-0,000212
4443;83,110647;192.168.1.9;31.13.68.60;TLSv1.2;89;Application Data;;;83,110647;83,110755;0,000108;-0,018431;0,018539;0,03697
4444;83,110755;192.168.1.9;31.13.68.60;TLSv1.2;89;Application Data;;;83,110755;83,129294;0,018539;-20,748822;20,767361;41,516183
4445;83,129294;31.13.68.60;192.168.1.9;TCP;56;443  >  49703 [ACK] Seq=3614 Ack=604 Win=546 Len=0;;;83,129294;103,896655;20,767361;20,765665;0,001696;-20,763969
5141;103,896655;31.13.68.60;192.168.1.9;TLSv1.2;151;Application Data;;;103,896655;103,898351;0,001696;0,000971;0,000725;-0,000246
5142;103,898351;192.168.1.9;31.13.68.60;TLSv1.2;89;Application Data;;;103,898351;103,899076;0,000725;-0,017574;0,018299;0,035873
5143;103,899076;192.168.1.9;31.13.68.60;TLSv1.2;89;Application Data;;;103,899076;103,917375;0,018299;-0,157016;0,175315;0,332331
5144;103,917375;31.13.68.60;192.168.1.9;TCP;56;443  >  49703 [ACK] Seq=3711 Ack=674 Win=546 Len=0;;;103,917375;104,09269;0,175315;0,11859;0,056725;-0,061865
5145;104,09269;31.13.68.60;192.168.1.9;TLSv1.2;191;Application Data;;;104,09269;104,149415;0,056725;-0,514257;0,570982;1,085239
5146;104,149415;192.168.1.9;31.13.68.60;TCP;54;49703  >  443 [ACK] Seq=674 Ack=3848 Win=2483 Len=0;;;104,149415;104,720397;0,570982;0,52605;0,044932;-0,481118
5147;104,720397;31.13.68.60;192.168.1.9;TLSv1.2;191;Application Data;;;104,720397;104,765329;0,044932;-0,625491;0,670423;1,295914
5148;104,765329;192.168.1.9;31.13.68.60;TCP;54;49703  >  443 [ACK] Seq=674 Ack=3985 Win=2482 Len=0;;;104,765329;105,435752;0,670423;0,629007;0,041416;-0,587591
5379;105,435752;31.13.68.60;192.168.1.9;TLSv1.2;1118;Application Data;;;105,435752;105,477168;0,041416;-5,240013;5,281429;10,521442
5380;105,477168;192.168.1.9;31.13.68.60;TCP;54;49703  >  443 [ACK] Seq=674 Ack=5049 Win=2484 Len=0;;;105,477168;110,758597;5,281429;5,280999;0,00043;-5,280569
5853;110,758597;31.13.68.60;192.168.1.9;TLSv1.2;287;Application Data;;;110,758597;110,759027;0,00043;0,00031;0,00012;-0,00019
5854;110,759027;192.168.1.9;31.13.68.60;TLSv1.2;89;Application Data;;;110,759027;110,759147;0,00012;-0,000346;0,000466;0,000812
5855;110,759147;192.168.1.9;31.13.68.60;TLSv1.2;89;Application Data;;;110,759147;110,759613;0,000466;0,00043;0,000036;-0,000394
5856;110,759613;31.13.68.60;192.168.1.9;TCP;287;[TCP Spurious Retransmission] 443  >  49703 [PSH, ACK] Seq=5049 Ack=674 Win=546 Len=233;;;110,759613;110,759649;0,000036;-0,019732;0,019768;0,0395
5857;110,759649;192.168.1.9;31.13.68.60;TCP;66;[TCP Dup ACK 5854#1] 49703  >  443 [ACK] Seq=744 Ack=5282 Win=2484 Len=0 SLE=5049 SRE=5282;;;110,759649;110,779417;0,019768;-6,657617;6,677385;13,335002
5858;110,779417;31.13.68.60;192.168.1.9;TCP;56;443  >  49703 [ACK] Seq=5282 Ack=744 Win=546 Len=0;;;110,779417;117,456802;6,677385;6,676957;0,000428;-6,676529
5859;117,456802;31.13.68.60;192.168.1.9;TLSv1.2;151;Application Data;;;117,456802;117,45723;0,000428;0,000309;0,000119;-0,00019
5860;117,45723;192.168.1.9;31.13.68.60;TLSv1.2;89;Application Data;;;117,45723;117,457349;0,000119;-0,04429;0,044409;0,088699
5861;117,457349;192.168.1.9;31.13.68.60;TLSv1.2;89;Application Data;;;117,457349;117,501758;0,044409;-1,858417;1,902826;3,761243
5862;117,501758;31.13.68.60;192.168.1.9;TCP;56;443  >  49703 [ACK] Seq=5379 Ack=814 Win=546 Len=0;;;117,501758;119,404584;1,902826;1,880456;0,02237;-1,858086
5873;119,404584;192.168.1.9;172.217.194.188;TCP;55;[TCP Keep-Alive] 49717  >  5228 [ACK] Seq=1 Ack=1 Win=511 Len=1;;;119,404584;119,426954;0,02237;-1,674137;1,696507;3,370644
5874;119,426954;172.217.194.188;192.168.1.9;TCP;66;[TCP Keep-Alive ACK] 5228  >  49717 [ACK] Seq=1 Ack=2 Win=265 Len=0 SLE=1 SRE=2;;;119,426954;121,123461;1,696507;1,646253;0,050254;-1,595999
5875;121,123461;31.13.68.60;192.168.1.9;TLSv1.2;271;Application Data;;;121,123461;121,173715;0,050254;-9,211088;9,261342;18,47243
5876;121,173715;192.168.1.9;31.13.68.60;TCP;54;49703  >  443 [ACK] Seq=814 Ack=5596 Win=2482 Len=0;;;121,173715;130,435057;9,261342;9,260879;0,000463;-9,260416
5898;130,435057;31.13.68.60;192.168.1.9;TLSv1.2;189;Application Data;;;130,435057;130,43552;0,000463;0,000327;0,000136;-0,000191
5899;130,43552;192.168.1.9;31.13.68.60;TLSv1.2;89;Application Data;;;130,43552;130,435656;0,000136;-0,0188;0,018936;0,037736
5900;130,435656;192.168.1.9;31.13.68.60;TLSv1.2;89;Application Data;;;130,435656;130,454592;0,018936;-5,063809;5,082745;10,146554
5901;130,454592;31.13.68.60;192.168.1.9;TCP;56;443  >  49703 [ACK] Seq=5731 Ack=884 Win=546 Len=0;;;130,454592;135,537337;5,082745;5,08234;0,000405;-5,081935
5904;135,537337;31.13.68.60;192.168.1.9;TLSv1.2;271;Application Data;;;135,537337;135,537742;0,000405;0,000286;0,000119;-0,000167
5905;135,537742;192.168.1.9;31.13.68.60;TLSv1.2;89;Application Data;;;135,537742;135,537861;0,000119;-0,011119;0,011238;0,022357
5906;135,537861;192.168.1.9;31.13.68.60;TLSv1.2;89;Application Data;;;135,537861;135,549099;0,011238;-0,000561;0,011799;0,01236
5907;135,549099;31.13.68.60;192.168.1.9;TLSv1.2;232;Application Data;;;135,549099;135,560898;0,011799;-0,019255;0,031054;0,050309
5908;135,560898;31.13.68.60;192.168.1.9;TCP;56;443  >  49703 [ACK] Seq=6126 Ack=954 Win=546 Len=0;;;135,560898;135,591952;0,031054;-0,157757;0,188811;0,346568
5909;135,591952;192.168.1.9;31.13.68.60;TCP;54;49703  >  443 [ACK] Seq=954 Ack=6126 Win=2480 Len=0;;;135,591952;135,780763;0,188811;0,124305;0,064506;-0,059799
5910;135,780763;192.168.1.9;31.13.68.60;TLSv1.2;166;Application Data;;;135,780763;135,845269;0,064506;-0,07255;0,137056;0,209606
5911;135,845269;31.13.68.60;192.168.1.9;TCP;56;443  >  49703 [ACK] Seq=6126 Ack=1066 Win=546 Len=0;;;135,845269;135,982325;0,137056;0,096419;0,040637;-0,055782
5912;135,982325;31.13.68.60;192.168.1.9;TLSv1.2;96;Application Data;;;135,982325;136,022962;0,040637;-0,216727;0,257364;0,474091
5913;136,022962;192.168.1.9;31.13.68.60;TCP;54;49703  >  443 [ACK] Seq=1066 Ack=6168 Win=2480 Len=0;;;136,022962;136,280326;0,257364;0,216197;0,041167;-0,17503
5914;136,280326;31.13.68.60;192.168.1.9;TLSv1.2;978;Application Data;;;136,280326;136,321493;0,041167;-0,051014;0,092181;0,143195
5915;136,321493;192.168.1.9;31.13.68.60;TCP;54;49703  >  443 [ACK] Seq=1066 Ack=7092 Win=2484 Len=0;;;136,321493;136,413674;0,092181;0,045673;0,046508;0,000835
5916;136,413674;31.13.68.60;192.168.1.9;TLSv1.2;232;Application Data;;;136,413674;136,460182;0,046508;-4,970037;5,016545;9,986582
5917;136,460182;192.168.1.9;31.13.68.60;TCP;54;49703  >  443 [ACK] Seq=1066 Ack=7270 Win=2484 Len=0;;;136,460182;141,476727;5,016545;5,016147;0,000398;-5,015749
6028;141,476727;31.13.68.60;192.168.1.9;TLSv1.2;271;Application Data;;;141,476727;141,477125;0,000398;0,000291;0,000107;-0,000184
6029;141,477125;192.168.1.9;31.13.68.60;TLSv1.2;89;Application Data;;;141,477125;141,477232;0,000107;-0,000553;0,00066;0,001213
6030;141,477232;192.168.1.9;31.13.68.60;TLSv1.2;89;Application Data;;;141,477232;141,477892;0,00066;-0,01662;0,01728;0,0339
6031;141,477892;31.13.68.60;192.168.1.9;TLSv1.2;232;Application Data;;;141,477892;141,495172;0,01728;0,01728;0;-0,01728
6032;141,495172;31.13.68.60;192.168.1.9;TCP;56;443  >  49703 [ACK] Seq=7665 Ack=1101 Win=546 Len=0;;;141,495172;141,495172;0;-0,031948;0,031948;0,063896
6033;141,495172;31.13.68.60;192.168.1.9;TCP;56;443  >  49703 [ACK] Seq=7665 Ack=1136 Win=546 Len=0;;;141,495172;141,52712;0,031948;-0,941972;0,97392;1,915892
6034;141,52712;192.168.1.9;31.13.68.60;TCP;54;49703  >  443 [ACK] Seq=1136 Ack=7665 Win=2482 Len=0;;;141,52712;142,50104;0,97392;0,925544;0,048376;-0,877168
6035;142,50104;31.13.68.60;192.168.1.9;TLSv1.2;232;Application Data;;;142,50104;142,549416;0,048376;-2,662232;2,710608;5,37284
6036;142,549416;192.168.1.9;31.13.68.60;TCP;54;49703  >  443 [ACK] Seq=1136 Ack=7843 Win=2482 Len=0;;;142,549416;145,260024;2,710608;2,703417;0,007191;-2,696226
6037;145,260024;192.168.1.9;204.79.197.219;TCP;66;49836  >  443 [SYN] Seq=0 Win=64240 Len=0 MSS=1460 WS=256 SACK_PERM=1;;;145,260024;145,267215;0,007191;-0,013906;0,021097;0,035003
6038;145,267215;192.168.1.9;204.79.197.219;TCP;66;49837  >  443 [SYN] Seq=0 Win=64240 Len=0 MSS=1460 WS=256 SACK_PERM=1;;;145,267215;145,288312;0,021097;0,020942;0,000155;-0,020787
6039;145,288312;204.79.197.219;192.168.1.9;TCP;66;443  >  49836 [SYN, ACK] Seq=0 Ack=1 Win=65535 Len=0 MSS=1440 WS=256 SACK_PERM=1;;;145,288312;145,288467;0,000155;-0,000387;0,000542;0,000929
6040;145,288467;192.168.1.9;204.79.197.219;TCP;54;49836  >  443 [ACK] Seq=1 Ack=1 Win=132352 Len=0;;;145,288467;145,289009;0,000542;-0,002297;0,002839;0,005136
6041;145,289009;192.168.1.9;204.79.197.219;TLSv1.2;646;Client Hello;;;145,289009;145,291848;0,002839;0,002754;0,000085;-0,002669
6042;145,291848;204.79.197.219;192.168.1.9;TCP;66;443  >  49837 [SYN, ACK] Seq=0 Ack=1 Win=65535 Len=0 MSS=1440 WS=256 SACK_PERM=1;;;145,291848;145,291933;0,000085;-0,000279;0,000364;0,000643
6043;145,291933;192.168.1.9;204.79.197.219;TCP;54;49837  >  443 [ACK] Seq=1 Ack=1 Win=132352 Len=0;;;145,291933;145,292297;0,000364;-0,025869;0,026233;0,052102
6044;145,292297;192.168.1.9;204.79.197.219;TLSv1.2;646;Client Hello;;;145,292297;145,31853;0,026233;0,026233;0;-0,026233
6045;145,31853;204.79.197.219;192.168.1.9;TCP;54;443  >  49836 [ACK] Seq=1 Ack=593 Win=4194048 Len=0;;;145,31853;145,31853;0;-0,000783;0,000783;0,001566
6046;145,31853;204.79.197.219;192.168.1.9;TLSv1.2;208;Server Hello, Change Cipher Spec, Encrypted Handshake Message;;;145,31853;145,319313;0,000783;0,000783;0;-0,000783
6047;145,319313;204.79.197.219;192.168.1.9;TCP;54;443  >  49837 [ACK] Seq=1 Ack=593 Win=4194048 Len=0;;;145,319313;145,319313;0;-0,010264;0,010264;0,020528
6048;145,319313;204.79.197.219;192.168.1.9;TLSv1.2;208;Server Hello, Change Cipher Spec, Encrypted Handshake Message;;;145,319313;145,329577;0,010264;0,009763;0,000501;-0,009262
6049;145,329577;192.168.1.9;204.79.197.219;TLSv1.2;105;Change Cipher Spec, Encrypted Handshake Message;;;145,329577;145,330078;0,000501;0,000238;0,000263;0,000025
6050;145,330078;192.168.1.9;204.79.197.219;TLSv1.2;105;Change Cipher Spec, Encrypted Handshake Message;;;145,330078;145,330341;0,000263;-0,000003;0,000266;0,000269
6051;145,330341;192.168.1.9;204.79.197.219;TCP;54;49837  >  443 [FIN, ACK] Seq=644 Ack=155 Win=132096 Len=0;;;145,330341;145,330607;0,000266;-0,000091;0,000357;0,000448
6052;145,330607;192.168.1.9;204.79.197.219;TLSv1.2;153;Application Data;;;145,330607;145,330964;0,000357;-0,02409;0,024447;0,048537
6053;145,330964;192.168.1.9;204.79.197.219;TLSv1.2;593;Application Data;;;145,330964;145,355411;0,024447;0,024447;0;-0,024447
6054;145,355411;204.79.197.219;192.168.1.9;TCP;54;443  >  49836 [ACK] Seq=155 Ack=644 Win=4194048 Len=0;;;145,355411;145,355411;0;0;0;0
6055;145,355411;204.79.197.219;192.168.1.9;TCP;54;443  >  49836 [ACK] Seq=155 Ack=1282 Win=4193536 Len=0;;;145,355411;145,355411;0;0;0;0
6056;145,355411;204.79.197.219;192.168.1.9;TLSv1.2;123;Application Data;;;145,355411;145,355411;0;0;0;0
6057;145,355411;204.79.197.219;192.168.1.9;TCP;54;443  >  49837 [ACK] Seq=155 Ack=644 Win=4194048 Len=0;;;145,355411;145,355411;0;-0,000219;0,000219;0,000438
6058;145,355411;204.79.197.219;192.168.1.9;TCP;54;443  >  49837 [ACK] Seq=155 Ack=645 Win=4194048 Len=0;;;145,355411;145,35563;0,000219;0,000219;0;-0,000219
6059;145,35563;204.79.197.219;192.168.1.9;TCP;54;443  >  49837 [RST, ACK] Seq=224 Ack=645 Win=0 Len=0;;;145,35563;145,35563;0;-0,000062;0,000062;0,000124
6060;145,35563;204.79.197.219;192.168.1.9;TCP;123;[TCP Retransmission] 443  >  49837 [PSH, ACK] Seq=155 Ack=645 Win=4194048 Len=69;;;145,35563;145,355692;0,000062;-0,000334;0,000396;0,00073
6061;145,355692;192.168.1.9;204.79.197.219;TCP;54;49837  >  443 [RST, ACK] Seq=645 Ack=224 Win=0 Len=0;;;145,355692;145,356088;0,000396;-0,00243;0,002826;0,005256
6062;145,356088;192.168.1.9;204.79.197.219;TLSv1.2;92;Application Data;;;145,356088;145,358914;0,002826;0,002826;0;-0,002826
6063;145,358914;204.79.197.219;192.168.1.9;TLSv1.2;331;Application Data, Application Data;;;145,358914;145,358914;0;-0,000071;0,000071;0,000142
6064;145,358914;204.79.197.219;192.168.1.9;TLSv1.2;92;Application Data;;;145,358914;145,358985;0,000071;-0,02117;0,021241;0,042411
6065;145,358985;192.168.1.9;204.79.197.219;TCP;54;49836  >  443 [ACK] Seq=1320 Ack=539 Win=131840 Len=0;;;145,358985;145,380226;0,021241;-1,1958;1,217041;2,412841
6066;145,380226;204.79.197.219;192.168.1.9;TCP;54;443  >  49836 [ACK] Seq=539 Ack=1320 Win=4193280 Len=0;;;145,380226;146,597267;1,217041;1,216575;0,000466;-1,216109
6067;146,597267;31.13.68.60;192.168.1.9;TLSv1.2;287;Application Data;;;146,597267;146,597733;0,000466;0,000337;0,000129;-0,000208
6068;146,597733;192.168.1.9;31.13.68.60;TLSv1.2;89;Application Data;;;146,597733;146,597862;0,000129;-0,000112;0,000241;0,000353
6069;146,597862;192.168.1.9;31.13.68.60;TLSv1.2;89;Application Data;;;146,597862;146,598103;0,000241;-0,02118;0,021421;0,042601
6070;146,598103;31.13.68.60;192.168.1.9;TLSv1.2;232;Application Data;;;146,598103;146,619524;0,021421;0,021421;0;-0,021421
6071;146,619524;31.13.68.60;192.168.1.9;TCP;56;443  >  49703 [ACK] Seq=8254 Ack=1171 Win=546 Len=0;;;146,619524;146,619524;0;-0,036653;0,036653;0,073306
6072;146,619524;31.13.68.60;192.168.1.9;TCP;56;443  >  49703 [ACK] Seq=8254 Ack=1206 Win=546 Len=0;;;146,619524;146,656177;0,036653;-0,684955;0,721608;1,406563
6073;146,656177;192.168.1.9;31.13.68.60;TCP;54;49703  >  443 [ACK] Seq=1206 Ack=8254 Win=2480 Len=0;;;146,656177;147,377785;0,721608;0,719294;0,002314;-0,71698
6082;147,377785;31.13.68.60;192.168.1.9;TLSv1.2;151;Application Data;;;147,377785;147,380099;0,002314;0,002215;0,000099;-0,002116
6083;147,380099;31.13.68.60;192.168.1.9;TLSv1.2;232;Application Data;;;147,380099;147,380198;0,000099;-3,722303;3,722402;7,444705
6084;147,380198;192.168.1.9;31.13.68.60;TCP;54;49703  >  443 [ACK] Seq=1206 Ack=8529 Win=2484 Len=0;;;147,380198;151,1026;3,722402;3,668725;0,053677;-3,615048
6085;151,1026;31.13.68.60;192.168.1.9;TLSv1.2;271;Application Data;;;151,1026;151,156277;0,053677;-1,125543;1,17922;2,304763
6086;151,156277;192.168.1.9;31.13.68.60;TCP;54;49703  >  443 [ACK] Seq=1206 Ack=8746 Win=2484 Len=0;;;151,156277;152,335497;1,17922;1,178773;0,000447;-1,178326
6087;152,335497;31.13.68.60;192.168.1.9;TLSv1.2;151;Application Data;;;152,335497;152,335944;0,000447;0,000288;0,000159;-0,000129
6088;152,335944;192.168.1.9;31.13.68.60;TLSv1.2;89;Application Data;;;152,335944;152,336103;0,000159;-0,027146;0,027305;0,054451
6089;152,336103;192.168.1.9;31.13.68.60;TLSv1.2;89;Application Data;;;152,336103;152,363408;0,027305;0,027305;0;-0,027305
6090;152,363408;31.13.68.60;192.168.1.9;TCP;56;443  >  49703 [ACK] Seq=8843 Ack=1241 Win=546 Len=0;;;152,363408;152,363408;0;-2,117987;2,117987;4,235974
6091;152,363408;31.13.68.60;192.168.1.9;TCP;56;443  >  49703 [ACK] Seq=8843 Ack=1276 Win=546 Len=0;;;152,363408;154,481395;2,117987;2,073485;0,044502;-2,028983
6092;154,481395;31.13.68.60;192.168.1.9;TLSv1.2;383;Application Data;;;154,481395;154,525897;0,044502;-0,024905;0,069407;0,094312
6093;154,525897;192.168.1.9;31.13.68.60;TCP;54;49703  >  443 [ACK] Seq=1276 Ack=9172 Win=2482 Len=0;;;154,525897;154,595304;0,069407;0,016889;0,052518;0,035629
6094;154,595304;31.13.68.60;192.168.1.9;TLSv1.2;151;Application Data;;;154,595304;154,647822;0,052518;-0,599874;0,652392;1,252266
6095;154,647822;192.168.1.9;31.13.68.60;TCP;54;49703  >  443 [ACK] Seq=1276 Ack=9269 Win=2482 Len=0;;;154,647822;155,300214;0,652392;0,651173;0,001219;-0,649954
6096;155,300214;31.13.68.60;192.168.1.9;TLSv1.2;255;Application Data;;;155,300214;155,301433;0,001219;0,001154;0,000065;-0,001089
6097;155,301433;31.13.68.60;192.168.1.9;TLSv1.2;232;Application Data;;;155,301433;155,301498;0,000065;-0,861819;0,861884;1,723703
6098;155,301498;192.168.1.9;31.13.68.60;TCP;54;49703  >  443 [ACK] Seq=1276 Ack=9648 Win=2480 Len=0;;;155,301498;156,163382;0,861884;0,804578;0,057306;-0,747272
6106;156,163382;31.13.68.60;192.168.1.9;TLSv1.2;232;Application Data;;;156,163382;156,220688;0,057306;-2,504191;2,561497;5,065688
6107;156,220688;192.168.1.9;31.13.68.60;TCP;54;49703  >  443 [ACK] Seq=1276 Ack=9826 Win=2479 Len=0;;;156,220688;158,782185;2,561497;2,561037;0,00046;-2,560577
6108;158,782185;31.13.68.60;192.168.1.9;TLSv1.2;287;Application Data;;;158,782185;158,782645;0,00046;0,000331;0,000129;-0,000202
6109;158,782645;192.168.1.9;31.13.68.60;TLSv1.2;89;Application Data;;;158,782645;158,782774;0,000129;-0,01934;0,019469;0,038809
6110;158,782774;192.168.1.9;31.13.68.60;TLSv1.2;89;Application Data;;;158,782774;158,802243;0,019469;0,019469;0;-0,019469
6111;158,802243;31.13.68.60;192.168.1.9;TCP;56;443  >  49703 [ACK] Seq=10059 Ack=1311 Win=546 Len=0;;;158,802243;158,802243;0;-2,744397;2,744397;5,488794
6112;158,802243;31.13.68.60;192.168.1.9;TCP;56;443  >  49703 [ACK] Seq=10059 Ack=1346 Win=546 Len=0;;;158,802243;161,54664;2,744397;2,742949;0,001448;-2,741501
6113;161,54664;31.13.68.60;192.168.1.9;TLSv1.2;271;Application Data;;;161,54664;161,548088;0,001448;0,00137;0,000078;-0,001292
6114;161,548088;31.13.68.60;192.168.1.9;TLSv1.2;232;Application Data;;;161,548088;161,548166;0,000078;-0,817744;0,817822;1,635566
6115;161,548166;192.168.1.9;31.13.68.60;TCP;54;49703  >  443 [ACK] Seq=1346 Ack=10454 Win=2483 Len=0;;;161,548166;162,365988;0,817822;0,770608;0,047214;-0,723394
6116;162,365988;31.13.68.60;192.168.1.9;TLSv1.2;232;Application Data;;;162,365988;162,413202;0,047214;-1,96633;2,013544;3,979874
6117;162,413202;192.168.1.9;31.13.68.60;TCP;54;49703  >  443 [ACK] Seq=1346 Ack=10632 Win=2482 Len=0;;;162,413202;164,426746;2,013544;1,992211;0,021333;-1,970878
6118;164,426746;192.168.1.9;172.217.194.188;TCP;55;[TCP Keep-Alive] 49717  >  5228 [ACK] Seq=1 Ack=1 Win=511 Len=1;;;164,426746;164,448079;0,021333;-14,999758;15,021091;30,020849
6119;164,448079;172.217.194.188;192.168.1.9;TCP;66;[TCP Keep-Alive ACK] 5228  >  49717 [ACK] Seq=1 Ack=2 Win=265 Len=0 SLE=1 SRE=2;;;164,448079;179,46917;15,021091;15,020621;0,00047;-15,020151
6177;179,46917;31.13.68.60;192.168.1.9;TLSv1.2;271;Application Data;;;179,46917;179,46964;0,00047;0,000274;0,000196;-0,000078
6178;179,46964;192.168.1.9;31.13.68.60;TLSv1.2;89;Application Data;;;179,46964;179,469836;0,000196;-0,000706;0,000902;0,001608
6179;179,469836;192.168.1.9;31.13.68.60;TLSv1.2;89;Application Data;;;179,469836;179,470738;0,000902;-0,016037;0,016939;0,032976
6180;179,470738;31.13.68.60;192.168.1.9;TLSv1.2;232;Application Data;;;179,470738;179,487677;0,016939;0,016939;0;-0,016939
6181;179,487677;31.13.68.60;192.168.1.9;TCP;56;443  >  49703 [ACK] Seq=11027 Ack=1381 Win=546 Len=0;;;179,487677;179,487677;0;-0,030958;0,030958;0,061916
6182;179,487677;31.13.68.60;192.168.1.9;TCP;56;443  >  49703 [ACK] Seq=11027 Ack=1416 Win=546 Len=0;;;179,487677;179,518635;0,030958;-0,944433;0,975391;1,919824
6183;179,518635;192.168.1.9;31.13.68.60;TCP;54;49703  >  443 [ACK] Seq=1416 Ack=11027 Win=2481 Len=0;;;179,518635;180,494026;0,975391;0,932869;0,042522;-0,890347
6186;180,494026;31.13.68.60;192.168.1.9;TLSv1.2;232;Application Data;;;180,494026;180,536548;0,042522;-4,110505;4,153027;8,263532
6187;180,536548;192.168.1.9;31.13.68.60;TCP;54;49703  >  443 [ACK] Seq=1416 Ack=11205 Win=2480 Len=0;;;180,536548;184,689575;4,153027;4,15257;0,000457;-4,152113
6190;184,689575;31.13.68.60;192.168.1.9;TLSv1.2;151;Application Data;;;184,689575;184,690032;0,000457;0,000349;0,000108;-0,000241
6191;184,690032;192.168.1.9;31.13.68.60;TLSv1.2;89;Application Data;;;184,690032;184,69014;0,000108;-0,018613;0,018721;0,037334
6192;184,69014;192.168.1.9;31.13.68.60;TLSv1.2;89;Application Data;;;184,69014;184,708861;0,018721;0,018252;0,000469;-0,017783
6193;184,708861;31.13.68.60;192.168.1.9;TCP;56;443  >  49703 [ACK] Seq=11302 Ack=1451 Win=546 Len=0;;;184,708861;184,70933;0,000469;-1,724824;1,725293;3,450117
6194;184,70933;31.13.68.60;192.168.1.9;TCP;56;443  >  49703 [ACK] Seq=11302 Ack=1486 Win=546 Len=0;;;184,70933;186,434623;1,725293;1,684384;0,040909;-1,643475
6195;186,434623;31.13.68.60;192.168.1.9;TLSv1.2;367;Application Data;;;186,434623;186,475532;0,040909;-1,659441;1,70035;3,359791
6196;186,475532;192.168.1.9;31.13.68.60;TCP;54;49703  >  443 [ACK] Seq=1486 Ack=11615 Win=2484 Len=0;;;186,475532;188,175882;1,70035;1,650478;0,049872;-1,600606
6197;188,175882;31.13.68.60;192.168.1.9;TLSv1.2;151;Application Data;;;188,175882;188,225754;0,049872;-2,114504;2,164376;4,27888
6198;188,225754;192.168.1.9;31.13.68.60;TCP;54;49703  >  443 [ACK] Seq=1486 Ack=11712 Win=2484 Len=0;;;188,225754;190,39013;2,164376;2,137398;0,026978;-2,11042
6199;190,39013;192.168.1.9;204.79.197.219;TCP;55;[TCP Keep-Alive] 49836  >  443 [ACK] Seq=1319 Ack=539 Win=131840 Len=1;;;190,39013;190,417108;0,026978;-1,516254;1,543232;3,059486
6200;190,417108;204.79.197.219;192.168.1.9;TCP;66;[TCP Keep-Alive ACK] 443  >  49836 [ACK] Seq=539 Ack=1320 Win=4193280 Len=0 SLE=1319 SRE=1320;;;190,417108;191,96034;1,543232;1,542758;0,000474;-1,542284
6201;191,96034;31.13.68.60;192.168.1.9;TLSv1.2;287;Application Data;;;191,96034;191,960814;0,000474;0,000097;0,000377;0,00028
6202;191,960814;192.168.1.9;31.13.68.60;TLSv1.2;89;Application Data;;;191,960814;191,961191;0,000377;-0,018532;0,018909;0,037441
6203;191,961191;192.168.1.9;31.13.68.60;TLSv1.2;89;Application Data;;;191,961191;191,9801;0,018909;0,018909;0;-0,018909
6204;191,9801;31.13.68.60;192.168.1.9;TCP;56;443  >  49703 [ACK] Seq=11945 Ack=1521 Win=546 Len=0;;;191,9801;191,9801;0;-6,532775;6,532775;13,06555
6205;191,9801;31.13.68.60;192.168.1.9;TCP;56;443  >  49703 [ACK] Seq=11945 Ack=1556 Win=546 Len=0;;;191,9801;198,512875;6,532775;6,532349;0,000426;-6,531923
6213;198,512875;31.13.68.60;192.168.1.9;TLSv1.2;151;Application Data;;;198,512875;198,513301;0,000426;0,000298;0,000128;-0,00017
6214;198,513301;192.168.1.9;31.13.68.60;TLSv1.2;89;Application Data;;;198,513301;198,513429;0,000128;-0,018949;0,019077;0,038026
6215;198,513429;192.168.1.9;31.13.68.60;TLSv1.2;89;Application Data;;;198,513429;198,532506;0,019077;0,019077;0;-0,019077
6216;198,532506;31.13.68.60;192.168.1.9;TCP;56;443  >  49703 [ACK] Seq=12042 Ack=1591 Win=546 Len=0;;;198,532506;198,532506;0;-4,316441;4,316441;8,632882
6217;198,532506;31.13.68.60;192.168.1.9;TCP;56;443  >  49703 [ACK] Seq=12042 Ack=1626 Win=546 Len=0;;;198,532506;202,848947;4,316441;4,316441;0;-4,316441
6225;202,848947;31.13.68.60;192.168.1.9;TLSv1.2;151;Application Data;;;202,848947;202,848947;0;-0,000119;0,000119;0,000238
6226;202,848947;31.13.68.60;192.168.1.9;TLSv1.2;151;Application Data;;;202,848947;202,849066;0,000119;-1,9128;1,912919;3,825719
6227;202,849066;192.168.1.9;31.13.68.60;TCP;54;49703  >  443 [ACK] Seq=1626 Ack=12236 Win=2482 Len=0;;;202,849066;204,761985;1,912919;1,912744;0,000175;-1,912569
6228;204,761985;31.13.68.60;192.168.1.9;TLSv1.2;287;Application Data;;;204,761985;204,76216;0,000175;0,000128;0,000047;-0,000081
6229;204,76216;31.13.68.60;192.168.1.9;TLSv1.2;232;Application Data;;;204,76216;204,762207;0,000047;-0,00025;0,000297;0,000547
6230;204,762207;192.168.1.9;31.13.68.60;TCP;54;49703  >  443 [ACK] Seq=1626 Ack=12647 Win=2480 Len=0;;;204,762207;204,762504;0,000297;0,000187;0,00011;-0,000077
6231;204,762504;192.168.1.9;31.13.68.60;TLSv1.2;89;Application Data;;;204,762504;204,762614;0,00011;-0,019068;0,019178;0,038246
6232;204,762614;192.168.1.9;31.13.68.60;TLSv1.2;89;Application Data;;;204,762614;204,781792;0,019178;0,019178;0;-0,019178
6233;204,781792;31.13.68.60;192.168.1.9;TCP;56;443  >  49703 [ACK] Seq=12647 Ack=1661 Win=546 Len=0;;;204,781792;204,781792;0;-0,694875;0,694875;1,38975
6234;204,781792;31.13.68.60;192.168.1.9;TCP;56;443  >  49703 [ACK] Seq=12647 Ack=1696 Win=546 Len=0;;;204,781792;205,476667;0,694875;0,645716;0,049159;-0,596557
6235;205,476667;31.13.68.60;192.168.1.9;TLSv1.2;232;Application Data;;;205,476667;205,525826;0,049159;-1,541143;1,590302;3,131445
6236;205,525826;192.168.1.9;31.13.68.60;TCP;54;49703  >  443 [ACK] Seq=1696 Ack=12825 Win=2480 Len=0;;;205,525826;207,116128;1,590302;1,535695;0,054607;-1,481088
6237;207,116128;31.13.68.60;192.168.1.9;TLSv1.2;287;Application Data;;;207,116128;207,170735;0,054607;-2,233792;2,288399;4,522191
6238;207,170735;192.168.1.9;31.13.68.60;TCP;54;49703  >  443 [ACK] Seq=1696 Ack=13058 Win=2484 Len=0;;;207,170735;209,459134;2,288399;2,261405;0,026994;-2,234411
6247;209,459134;192.168.1.9;172.217.194.188;TCP;55;[TCP Keep-Alive] 49717  >  5228 [ACK] Seq=1 Ack=1 Win=511 Len=1;;;209,459134;209,486128;0,026994;-10,709642;10,736636;21,446278
6248;209,486128;172.217.194.188;192.168.1.9;TCP;66;[TCP Keep-Alive ACK] 5228  >  49717 [ACK] Seq=1 Ack=2 Win=265 Len=0 SLE=1 SRE=2;;;209,486128;220,222764;10,736636;10,73618;0,000456;-10,735724
6249;220,222764;31.13.68.60;192.168.1.9;TLSv1.2;271;Application Data;;;220,222764;220,22322;0,000456;0,000332;0,000124;-0,000208
6250;220,22322;192.168.1.9;31.13.68.60;TLSv1.2;89;Application Data;;;220,22322;220,223344;0,000124;-0,001957;0,002081;0,004038
6251;220,223344;192.168.1.9;31.13.68.60;TLSv1.2;89;Application Data;;;220,223344;220,225425;0,002081;-0,0143;0,016381;0,030681
6252;220,225425;31.13.68.60;192.168.1.9;TLSv1.2;232;Application Data;;;220,225425;220,241806;0,016381;0,016381;0;-0,016381
6253;220,241806;31.13.68.60;192.168.1.9;TCP;56;443  >  49703 [ACK] Seq=13453 Ack=1731 Win=546 Len=0;;;220,241806;220,241806;0;-0,033719;0,033719;0,067438
6254;220,241806;31.13.68.60;192.168.1.9;TCP;56;443  >  49703 [ACK] Seq=13453 Ack=1766 Win=546 Len=0;;;220,241806;220,275525;0,033719;-0,732563;0,766282;1,498845
6255;220,275525;192.168.1.9;31.13.68.60;TCP;54;49703  >  443 [ACK] Seq=1766 Ack=13453 Win=2483 Len=0;;;220,275525;221,041807;0,766282;0,710975;0,055307;-0,655668
6256;221,041807;31.13.68.60;192.168.1.9;TLSv1.2;232;Application Data;;;221,041807;221,097114;0,055307;-4,907627;4,962934;9,870561
6257;221,097114;192.168.1.9;31.13.68.60;TCP;54;49703  >  443 [ACK] Seq=1766 Ack=13631 Win=2482 Len=0;;;221,097114;226,060048;4,962934;4,962504;0,00043;-4,962074
6258;226,060048;31.13.68.60;192.168.1.9;TLSv1.2;151;Application Data;;;226,060048;226,060478;0,00043;0,000308;0,000122;-0,000186
6259;226,060478;192.168.1.9;31.13.68.60;TLSv1.2;89;Application Data;;;226,060478;226,0606;0,000122;-0,01874;0,018862;0,037602
6260;226,0606;192.168.1.9;31.13.68.60;TLSv1.2;89;Application Data;;;226,0606;226,079462;0,018862;0,018862;0;-0,018862
6261;226,079462;31.13.68.60;192.168.1.9;TCP;56;443  >  49703 [ACK] Seq=13728 Ack=1801 Win=546 Len=0;;;226,079462;226,079462;0;-1,310489;1,310489;2,620978
6262;226,079462;31.13.68.60;192.168.1.9;TCP;56;443  >  49703 [ACK] Seq=13728 Ack=1836 Win=546 Len=0;;;226,079462;227,389951;1,310489;1,2538;0,056689;-1,197111
6263;227,389951;31.13.68.60;192.168.1.9;TLSv1.2;367;Application Data;;;227,389951;227,44664;0,056689;-0,018482;0,075171;0,093653
6264;227,44664;192.168.1.9;31.13.68.60;TCP;54;49703  >  443 [ACK] Seq=1836 Ack=14041 Win=2481 Len=0;;;227,44664;227,521811;0,075171;0,029618;0,045553;0,015935
6265;227,521811;31.13.68.60;192.168.1.9;TLSv1.2;151;Application Data;;;227,521811;227,567364;0,045553;-2,134333;2,179886;4,314219
6266;227,567364;192.168.1.9;31.13.68.60;TCP;54;49703  >  443 [ACK] Seq=1836 Ack=14138 Win=2480 Len=0;;;227,567364;229,74725;2,179886;2,132167;0,047719;-2,084448
6319;229,74725;31.13.68.60;192.168.1.9;TLSv1.2;151;Application Data;;;229,74725;229,794969;0,047719;-0,294386;0,342105;0,636491
6320;229,794969;192.168.1.9;31.13.68.60;TCP;54;49703  >  443 [ACK] Seq=1836 Ack=14235 Win=2480 Len=0;;;229,794969;230,137074;0,342105;0,295852;0,046253;-0,249599
6321;230,137074;31.13.68.60;192.168.1.9;TLSv1.2;151;Application Data;;;230,137074;230,183327;0,046253;-2,809461;2,855714;5,665175
6322;230,183327;192.168.1.9;31.13.68.60;TCP;54;49703  >  443 [ACK] Seq=1836 Ack=14332 Win=2479 Len=0;;;230,183327;233,039041;2,855714;2,854532;0,001182;-2,85335
6332;233,039041;31.13.68.60;192.168.1.9;TLSv1.2;189;Application Data;;;233,039041;233,040223;0,001182;0,000716;0,000466;-0,00025
6333;233,040223;192.168.1.9;31.13.68.60;TLSv1.2;89;Application Data;;;233,040223;233,040689;0,000466;-0,018382;0,018848;0,03723
6334;233,040689;192.168.1.9;31.13.68.60;TLSv1.2;89;Application Data;;;233,040689;233,059537;0,018848;0,018848;0;-0,018848
6335;233,059537;31.13.68.60;192.168.1.9;TCP;56;443  >  49703 [ACK] Seq=14467 Ack=1871 Win=546 Len=0;;;233,059537;233,059537;0;-0,281868;0,281868;0,563736
6336;233,059537;31.13.68.60;192.168.1.9;TCP;56;443  >  49703 [ACK] Seq=14467 Ack=1906 Win=546 Len=0;;;233,059537;233,341405;0,281868;0,235061;0,046807;-0,188254
